patient_id,timestamp,email,condition,diagnosis,treatment,follow_up_timeline,follow_up_date,email_sent,created_at
PT20251014140551,2025-10-14 14:05:51,test-patient@example.com,Severe tooth pain for 3 days,Dental caries,"The main treatment for dental caries involves the removal of decayed tooth material and restoration of the tooth with a filling. Depending on the severity, fluoride treatments may also be recommended to help remineralize early-stage caries. Regular dental check-ups are essential for monitoring and maintaining oral health.",2 weeks,2025-01-14,Yes,2025-10-14 14:05:51
PT20251014140558,2025-10-14 14:05:58,test-patient@example.com,Severe tooth pain for 3 days,Dental Caries,"The main treatment for dental caries includes the removal of the decayed portion of the tooth and restoration with a dental filling. In cases of advanced decay, a crown or root canal may be necessary. Regular dental check-ups and professional cleanings are also essential to prevent further decay.",2 weeks,2025-10-16,No,2025-10-14 14:05:58
PT20251014141333,2025-10-14 14:13:33,test-patient@example.com,Severe chest pain for 3 days,Acute coronary syndrome,"Initiate dual antiplatelet therapy (aspirin plus a P2Y12 inhibitor such as clopidogrel), administer anticoagulation (e.g., enoxaparin or unfractionated heparin), and consider early invasive evaluation (such as coronary angiography) if appropriate. Monitor for complications and provide supplemental oxygen if hypoxemia is present.",7 days,2025-10-21,No,2025-10-14 14:13:33
PT20251014143034,2025-10-14 14:30:34,yunuss@gmail.com,Tooth pain for 3 days,Dental caries or abscess,"Dental caries or abscess typically requires prompt evaluation by a dentist. Initial management may include drainage of the abscess if present, prescription of antibiotics if there are signs of infection, and removal of decayed tissue followed by restoration or root canal treatment. Over-the-counter pain relief can be used until definitive dental care is provided.",3-5 days,2025-10-17,No,2025-10-14 14:30:34
PT20251014144514,2025-10-14 14:45:14,yunuss@gmail.com,chest discomfort,Non-cardiac chest pain,"Non-cardiac chest pain is often managed with reassurance, lifestyle modification, and addressing underlying causes such as gastroesophageal reflux disease (GERD) or anxiety. Consider a trial of proton pump inhibitors if GERD is suspected, and cognitive behavioral therapy may be helpful if anxiety is a contributing factor.",2 weeks,2025-10-16,No,2025-10-14 14:45:14
PT20251014144915,2025-10-14 14:49:15,yunuss@gmail.com,feeling discomfort,Soft tissue inflammation,"Initial management of soft tissue inflammation typically includes rest of the affected area, application of ice packs for 15-20 minutes every few hours, and use of nonsteroidal anti-inflammatory drugs (NSAIDs) such as ibuprofen if not contraindicated. If symptoms persist or worsen, consult a healthcare provider for further evaluation.",7 days,2025-10-21,No,2025-10-14 14:49:15
PT20251014145007,2025-10-14 14:50:07,yunuss@gmail.com,feeling discomfort under my neck,Cervical degenerative disc disease,"Initial management of cervical degenerative disc disease typically involves conservative measures such as physical therapy to improve neck strength and flexibility, along with nonsteroidal anti-inflammatory drugs (NSAIDs) for pain relief. If symptoms persist or worsen, further evaluation for interventional procedures or surgical options may be considered.",4 weeks,2025-10-18,No,2025-10-14 14:50:07
PT20251014150108,2025-10-14 15:01:08,yunuss@gmail.com,"big discomfort, coughing from deep",Bilateral pneumonia,"Bilateral pneumonia typically requires prompt initiation of empiric antibiotic therapy, tailored to the most likely pathogens and adjusted based on culture results. Hospitalization may be necessary for severe cases to provide supplemental oxygen, intravenous fluids, and close monitoring of respiratory status.",7 days,2025-10-21,No,2025-10-14 15:01:08
